CREATED_AT,TWEET_ID,TWEET,USER_ID,USER_NAME,RETWEET_COUNT,FAVORITE_COUNT,HASHTAGS
2019-02-14 17:40:19,1096101845657735168,"RT @Stadium: Derrick Rose's journey is a redemption story told in 'A Rose From A Concrete Jungle.'

Pooh: The Derrick Rose Story. Coming to…",612792060,Derrick Rose,756,0,
2019-01-30 16:00:01,1090640786008358912,"Proud to share the story you don't know. 
Pooh: The Derrick Rose Story coming 4.11.19 
@watchstadium https://t.co/00KksSthuL",612792060,Derrick Rose,38181,88806,
2019-01-07 20:25:21,1082372638712852480,I messed up by using the slang term “kill yourself” today in response to a question about whether I can continue to… https://t.co/X4IjScJZw8,612792060,Derrick Rose,12787,126756,
2018-12-07 19:58:39,1071131895365218304,"RT @Timberwolves: “My whole life, all I had was my family, a ball, and a dream.”

@drose is whole again.🌹

Spotlight presented by @DraftKin…",612792060,Derrick Rose,3691,0,
2018-11-19 18:02:25,1064579665581432859,"Congratulations to Gabriel Lee, our Rose Scholar and Grand Prize winner who will be receiving up to $200,000 for hi… https://t.co/ruMkUBAVkt",612792060,Derrick Rose,2333,13115,
2018-11-15 17:13:17,1063117746743865344,"Congratulations to @_AlbertoOrtiz, our Rose Scholar receiving $10,000 for his college education at Middle Tennessee… https://t.co/Kk4mRbJSq3",612792060,Derrick Rose,875,6222,
2018-10-04 18:46:35,1047920937817976832,"RT @WatchStadium: Happy 30th Birthday to Chicago's very own, @drose. 🌹

#POOH: A Stadium Documentary, coming February. 👀 https://t.co/xOGSS…",612792060,Derrick Rose,1715,0,['POOH']
2018-09-21 22:09:57,1043261073929826304,Just got my YEEZY boost 350 V2 Triple Whites 🔥 Get yours on https://t.co/jr5DTk4vyp &amp; Yeezy Supply #giftedbyadidas https://t.co/BtNuTx1fez,612792060,Derrick Rose,996,7516,['giftedbyadidas']
2018-08-08 17:25:20,1027244382385102848,Out here in Xi'an! https://t.co/JutOCM0NF7,612792060,Derrick Rose,3300,18101,['giftedbyadidas']
2018-08-01 22:23:33,1024782716447813632,"I'm excited to share the launch of The Rose Scholars program, a scholarship program which seeks to give high school… https://t.co/b616jcTzsD",612792060,Derrick Rose,4781,15960,['giftedbyadidas']
2018-07-25 01:55:06,1021936848879247360,Really enjoyed an advanced screening of @MissionFilm. Ya’ll go see it when it opens July 27! Best one yet!… https://t.co/w0tEYmOPal,612792060,Derrick Rose,854,7023,['giftedbyadidas']
2018-07-20 20:23:32,1020403859032698880,"RT @WatchStadium: Today, newest @ChicagoBulls forward and fellow Simeon-alum Jabari Parker spoke highly of former Bull, @drose. 

For Derri…",612792060,Derrick Rose,936,0,['giftedbyadidas']
2018-07-16 20:28:49,1018955636510343168,Huge congrats to my friend @AntoGriezmann on the #WorldCup win and the Man of the Match honors in the final. Great… https://t.co/RoD3HxpBu9,612792060,Derrick Rose,9069,44825,['WorldCup']
2018-02-22 23:54:49,966823622709936129,RT @countermoveco: Office Vibes https://t.co/rEWDQLn5tm,612792060,Derrick Rose,232,0,['WorldCup']
2017-07-28 16:32:09,890973159385579520,"Las Vegas, catch me and the rest of my @adidasHoops fam hanging at #LVL3 today. See you there. https://t.co/jmpV1oAtmU",612792060,Derrick Rose,570,4222,['LVL3']
2017-07-25 16:59:49,889892958098530304,📍Las Vegas. July 27-28. Come hang with me at #LVL3 with @adidasHoops https://t.co/QqqYueWv8K,612792060,Derrick Rose,737,3804,['LVL3']
2017-06-30 17:50:06,880845915182911489,S/O to my adidas fam for the gear!  #crazy #giftedbyadidas @adidasoriginals https://t.co/8NoFA0g4Lr,612792060,Derrick Rose,645,4047,"['crazy', 'giftedbyadidas']"
2017-06-01 02:37:28,870106997705682945,Need all my followers to me a favor &amp; vote for @midwestdream_ for the 2017 TBT tourney. Voting ends at 12pm tomorro… https://t.co/NgCYoKgqDj,612792060,Derrick Rose,541,2420,"['crazy', 'giftedbyadidas']"
2016-12-06 19:59:24,806226554418130944,Me and my Rook!  # Knicks https://t.co/QIOAXQbMSi,612792060,Derrick Rose,2700,10361,"['crazy', 'giftedbyadidas']"
2016-09-03 00:53:03,771873609664962562,Doing work in @CallofDuty Infinite Warfare.  My man @MichaelPhelps is next up!  Who wants to play?  #CODXP2016 #ad https://t.co/teOemgQWUE,612792060,Derrick Rose,1259,5406,"['CODXP2016', 'ad']"
2016-07-21 18:30:27,756194643373469696,Check me out today at the @adidashoops #LVL3 experience at Planet Hollywood. I’ll be there from 4:30PM – 6:30PM https://t.co/iz8nvDN656,612792060,Derrick Rose,868,3788,['LVL3']
2016-06-24 20:44:27,746443896532705280,I'm ready for New York. https://t.co/Ib1GA4qbdc https://t.co/BP0uWIJfQX,612792060,Derrick Rose,18562,31302,['LVL3']
2015-12-02 00:53:45,671854732294488065,RT @chicagobulls: When Derrick Rose surprises you with a shopping spree! #NBACares https://t.co/K4tjjI1Nyr,612792060,Derrick Rose,1523,0,['NBACares']
2015-12-02 00:53:40,671854710777708544,"RT @chicagobulls: As part of #NBACares Season of Giving, @drose took teens from @AftrSchoolMttrs on a shopping spree to @adidasHoops! https…",612792060,Derrick Rose,527,0,['NBACares']
2015-11-11 18:21:45,664508326500175873,Looking for the Yeezy 350 boost?  Go check out adidas Style Chicago at 50 East Oak Street. Raffle sign up ends Thursday at 5pm.,612792060,Derrick Rose,464,2044,['NBACares']
2015-11-06 15:58:58,662660453651247104,"Thanks for all the love on my PJ shirt, get yours at https://t.co/mDMQdEK9tH 

@richgirlcandy @ziptanks https://t.co/nHrxG53pw9",612792060,Derrick Rose,1600,4698,['NBACares']
2015-04-23 02:32:55,591067194064130049,My guys #JoakimNoah and #PauGasol are finalists for the #NBACommunityAssist award. RT to cast your vote,612792060,Derrick Rose,6683,5762,"['JoakimNoah', 'PauGasol', 'NBACommunityAssist']"
2014-09-12 18:58:17,510502678053404672,Thank you @luciamartinez1_ for the gift! Keep working hard http://t.co/XrNjiHgu01,612792060,Derrick Rose,816,2583,"['JoakimNoah', 'PauGasol', 'NBACommunityAssist']"
2014-01-23 21:57:54,426473894808018944,Usually don't post pics but couldn't help it. Thanks @adidasHoops for the HARD work! It motivates me to keep GRINDING http://t.co/WIlRUE32Yc,612792060,Derrick Rose,4123,8125,"['JoakimNoah', 'PauGasol', 'NBACommunityAssist']"
2014-01-12 03:49:07,422213627823652865,CDR I'm happy to see you back. You deserve it man,612792060,Derrick Rose,1867,3570,"['JoakimNoah', 'PauGasol', 'NBACommunityAssist']"
2013-06-11 20:41:24,344554982789505025,In the gym working out listening to Born Sinner. @JColeNC you made me a believer. I appreciate yo music. I'll be supporting June 18th.,612792060,Derrick Rose,15347,12503,"['JoakimNoah', 'PauGasol', 'NBACommunityAssist']"
2013-03-07 22:26:28,309792189536415746,"I'm just having a bad day and want u to know ""The Boy"", lol, does have down days but thinking about yall having my BACK makes me feel good.",612792060,Derrick Rose,4515,4971,"['JoakimNoah', 'PauGasol', 'NBACommunityAssist']"
2013-03-07 22:26:26,309792180799672320,"Bren Bren lol, Wayne, Reg, Greedy and the rest of the Rose family I LOVE U.",612792060,Derrick Rose,736,1432,"['JoakimNoah', 'PauGasol', 'NBACommunityAssist']"
2013-03-07 22:26:06,309792098662612992,"What's the most important thing in life? To me, it's FAMILY...If you take away the fame &amp; fortune they're the ones that will always be there",612792060,Derrick Rose,11196,6692,"['JoakimNoah', 'PauGasol', 'NBACommunityAssist']"
2013-01-13 21:08:54,290566110225514496,Anything is possible. #blessed http://t.co/H5x9eYag,612792060,Derrick Rose,4333,5045,['blessed']
2012-11-27 20:12:36,273519713647226880,I'm all in for my fans RT @adidashoops: WORLD PREMIERE: #TheReturn of @drose Episode 6 - all in http://t.co/B7zVbokU,612792060,Derrick Rose,3529,2132,['TheReturn']
2012-11-06 13:59:54,265815775498104832,My lil man PJ http://t.co/6dCsbhyT,612792060,Derrick Rose,10543,11601,['TheReturn']
2012-11-06 13:59:01,265815553422266368,http://t.co/MPeEokAT,612792060,Derrick Rose,6537,6731,['TheReturn']
2012-11-06 13:58:42,265815471260065793,http://t.co/fcY9VW95,612792060,Derrick Rose,4265,6136,['TheReturn']
2012-10-21 19:10:15,260095672592769024,because five year went pass and it seem like I just left there! Be safe and Gotti what's up!,612792060,Derrick Rose,1107,1157,['TheReturn']
2012-10-21 19:09:28,260095475884113920,I just wanted to get that off my chest and let yall know that I miss everything about that city,612792060,Derrick Rose,1224,1356,['TheReturn']
2012-10-21 19:08:42,260095282182758400,I know yall remember the good times we had and how we had to make a name for ourselves.,612792060,Derrick Rose,1728,1374,['TheReturn']
2012-10-21 19:05:47,260094549848891392,had. Memphis will always be my second home no matter what! Yall showed me a lot of love and for that I will always stay loyal to you all.,612792060,Derrick Rose,2035,1759,['TheReturn']
2012-10-21 19:05:03,260094365320503298,I was up early thinking about how time goes by. I miss the times I had at the University of Memphis with my teammates and how much fun we,612792060,Derrick Rose,1872,2177,['TheReturn']
2012-10-19 15:58:41,259322689666289665,RT @adidasHoops: WORLD PREMIERE: #TheReturn of @drose Episode 5 - Drive http://t.co/ndar6ke4,612792060,Derrick Rose,1485,0,['TheReturn']
2012-10-18 01:34:01,258742700122206209,S/o to Taj McWilliams- Franklin of the Minnesota Lynx for wearing the D. Rose 3 in the WNBA finals...Good Luck!,612792060,Derrick Rose,594,683,['TheReturn']
2012-10-05 00:04:16,254009067897507841,The D Rose 3 launched today! Check them out and let me know what you think #TheReturn http://t.co/F6PYWn2t,612792060,Derrick Rose,2551,3222,['TheReturn']
2012-10-04 18:30:16,253925018864603138,RT @adidasHoops: WORLD PREMIERE: #TheReturn of @drose Episode 4 - Push. http://t.co/QikltRcS,612792060,Derrick Rose,1807,0,['TheReturn']
2012-10-02 22:20:30,253258180484816896,"RT @chicagobulls: #Bulls Captains pose at #mediaday. @drose, @LuolDeng9, @JoakimNoah, @MisterCBooz  @ Berto Center http://t.co/DPAgqcRb",612792060,Derrick Rose,1686,0,"['Bulls', 'mediaday']"
2012-09-27 02:01:08,251139379052044288,Got in my first game of #NBA2K13 at the @2ksports launch party. Y'all gotta check this game out! http://t.co/3FNn7tz7,612792060,Derrick Rose,3062,2957,['NBA2K13']
2012-09-25 22:04:12,250717363073323009,New @adidashoops commercial for my new shoe the #drose3.  Tell me what you think #TheReturn http://t.co/gtqsC56I,612792060,Derrick Rose,2145,1233,"['drose3', 'TheReturn']"
2012-09-20 22:16:13,248908450829049856,Best pizza in Chicago? That's easy... @giordanospizza,612792060,Derrick Rose,2931,1553,"['drose3', 'TheReturn']"
2012-09-19 21:01:22,248527226671362049,"RT @adidasHoops: WORLD PREMIERE: #TheReturn of @drose Episode 3 –
Focus http://t.co/AzESfrbo",612792060,Derrick Rose,1361,0,['TheReturn']
2012-09-13 16:05:10,246278350652444677,My new @adidashoops shoe the #drose3!!  What do you all think? #TheReturn http://t.co/SRzk825M,612792060,Derrick Rose,1795,1951,"['drose3', 'TheReturn']"
2012-09-13 14:56:28,246261068966531074,Just arrived at the @adidashoops event to launch my new shoe!! #TheReturn,612792060,Derrick Rose,1075,763,['TheReturn']
2012-09-12 01:23:28,245694080376512513,Chi town til I die!,612792060,Derrick Rose,32643,19540,['TheReturn']
2012-09-12 01:23:01,245693966916386816,I pray everyday for US for real. I know I shouldn't be saying this because I hoop and it's not my lane but I feel like ppl should hear this.,612792060,Derrick Rose,2344,1326,['TheReturn']
2012-09-12 01:22:14,245693772338446336,I don't like that fact that OUR kids are not in school and that's the only thing we have to SAVE these kids.,612792060,Derrick Rose,3137,1218,['TheReturn']
2012-09-12 01:21:24,245693560429608961,I'm sitting here just thinking how sad it is that my city got to go through this. I love my city and everyone in it even my haters!,612792060,Derrick Rose,3521,1745,['TheReturn']
2012-09-10 16:47:27,245201832215973889,Hope the CPS gets a deal done soon...we need our kids in school! #TheReturn,612792060,Derrick Rose,2606,832,['TheReturn']
2012-09-07 22:12:31,244196476023091201,RT @adidasHoops: WORLD PREMIER: #TheReturn of @drose Episode 2- HOPE http://t.co/6wzZUUek,612792060,Derrick Rose,1625,0,['TheReturn']
2012-09-05 17:19:38,243397992428756992,Praying for my city man... #TheReturn,612792060,Derrick Rose,5880,1969,['TheReturn']
2012-08-27 22:00:06,240207081850933248,Me and my Mom/Dad lol.  Love her to death! #thereturn http://t.co/3gDo5KqF,612792060,Derrick Rose,2431,3608,['thereturn']
2012-08-24 01:13:05,238806099191545858,It’s crazy to see all of the love and support from you all.  Thank you.  I am blessed. So glad you like my video. #TheReturn,612792060,Derrick Rose,2836,1594,['TheReturn']
2012-08-22 21:43:30,238390967890231296,Happy to share this with you all!! RT @adidashoops: WORLD PREMIERE: The Return of @drose Episode 1- BELIEF #TheReturn  http://t.co/lLlAA7lQ,612792060,Derrick Rose,3551,1470,['TheReturn']
2012-08-17 03:02:42,236296970682105856,Go follow my boys @BO_EE_TeamWinN and @callme_jd ASAP,612792060,Derrick Rose,170,313,['TheReturn']
2012-08-17 02:52:11,236294319244447744,Blessed!!! Bowling with the FAM #TheReturn http://t.co/BIzCPShc,612792060,Derrick Rose,1565,2344,['TheReturn']
2012-08-16 19:07:39,236177417826349056,Hard work isn't enough. You got to believe. #theReturn,612792060,Derrick Rose,16837,4898,['theReturn']
2012-08-15 21:20:56,235848571998576640,RT @adidasHoops: WORLD PREMIERE: The Return of D Rose. Every day @drose is getting stronger and faster. This is his story: http://t.co/r ...,612792060,Derrick Rose,3298,0,['theReturn']
2012-08-15 01:10:30,235543952177131521,Feels good to be back in the gym... http://t.co/mrhU7FQk,612792060,Derrick Rose,9897,7719,['theReturn']
2012-08-14 17:01:14,235420830601986050,Thank you all for the love and support. I feel blessed to have such great fans.  Good to be back in Chicago after training all summer in LA,612792060,Derrick Rose,3593,1650,['theReturn']
2012-08-12 16:01:40,234681064751247361,Congrats @USAbasketball for getting the gold! s/o to @russwest44 @kingjames @kevinlove @kdtrey5 @cp3 and everyone on #teamusa #olympics,612792060,Derrick Rose,5830,1163,"['teamusa', 'olympics']"
2012-08-12 13:51:29,234648301587292161,I want to wish everyone on @USAbasketball good luck today. Bring home the gold! Wish I could be out there with you all #teamusa #olympics,612792060,Derrick Rose,4365,1325,"['teamusa', 'olympics']"
